
<!--
        Data collection (DC) configuration DTD
        Date: 15 March 2007
        Version: 1.2
        Copyright (c) 2006,2007 Advanced Micro Devices, Inc. All rights reserved.

        This DTD checks the validity of CodeAnalyst data collection
        configuration XML files.
 -->

  <!ELEMENT dc_configuration (tbp|ebp|sim|ibs)>

  <!ELEMENT tbp (tool_tip,description)>
  <!ATTLIST tbp name            CDATA #REQUIRED>
  <!ATTLIST tbp interval        CDATA "1.0">

  <!ELEMENT sim (tool_tip,description)>
  <!ATTLIST sim name            CDATA #REQUIRED>
  <!ATTLIST sim warmup_caches   CDATA "T">
  <!ATTLIST sim run_sim_after   CDATA "T">
  <!ATTLIST sim save_trace      CDATA "T">
  <!ATTLIST sim multiplier      CDATA "15">
  <!ATTLIST sim proc_core       CDATA "AMD Athlon64">
  <!ATTLIST sim max_to_trace    CDATA "5">
  <!ATTLIST sim trace_file_name CDATA "">

  <!ELEMENT ebp (group+,tool_tip,description)>
  <!ATTLIST ebp name            CDATA #REQUIRED>
  <!ATTLIST ebp mux_period      CDATA "1">
  <!ATTLIST ebp num_groups      CDATA #IMPLIED>

  <!ELEMENT ibs (tool_tip,description)>
  <!ATTLIST ibs name            CDATA #REQUIRED>
  <!ATTLIST ibs fetch_sampling  CDATA "T">
  <!ATTLIST ibs op_sampling     CDATA "T">
  <!ATTLIST ibs fetch_max_count CDATA "250000">
  <!ATTLIST ibs op_max_count    CDATA "250000">

  <!ELEMENT group (event+)>
  <!ATTLIST group valid         CDATA #IMPLIED>

  <!ELEMENT event EMPTY>
  <!ATTLIST event select       CDATA #REQUIRED>
  <!ATTLIST event mask         CDATA #REQUIRED>
  <!ATTLIST event os           CDATA #REQUIRED>
  <!ATTLIST event user         CDATA #REQUIRED>
  <!ATTLIST event count        CDATA #REQUIRED>
  <!ATTLIST event edge_detect  CDATA "F">

  <!ELEMENT tool_tip    (#PCDATA)>
  <!ELEMENT description (#PCDATA)>
